{
  "$schema": "../../schemas/source-audit-coverage.schema.json",
  "schemaVersion": 1,
  "recordType": "source-audit-coverage",
  "id": "midnight-season-2/spec-source-audit-coverage",
  "status": "verified",
  "validity": {
    "fromBuild": "12.1.0.69587",
    "untilBuild": null,
    "seasonId": null,
    "seasonSlug": "midnight-season-2"
  },
  "isCatalogComplete": true,
  "summary": {
    "specializationCount": 40,
    "fullyAudited": 0,
    "partiallyAudited": 4,
    "provenanceOnly": 36,
    "noSource": 0
  },
  "entries": [
    {
      "specId": 265,
      "specSlug": "affliction-warlock",
      "matrixId": "midnight-season-2/affliction-warlock-utility-matrix",
      "coverageLevel": "provenance-only",
      "sourceUrls": [
        "https://www.wowhead.com/guide/classes/warlock/affliction/mythic-plus-dungeon-tips"
      ],
      "auditIds": [],
      "claimCount": 0,
      "claimsByType": {
        "mechanic-location": 0,
        "utility-rating": 0,
        "utility-mention": 0,
        "placeholder": 0
      },
      "claimsByDisposition": {
        "accepted": 0,
        "rejected-cross-dungeon": 0,
        "rejected-placeholder": 0,
        "unresolved": 0
      },
      "limitations": [
        "The matrix cites a specialization guide, but WHELP has not created a claim-level audit for it yet."
      ]
    },
    {
      "specId": 62,
      "specSlug": "arcane-mage",
      "matrixId": "midnight-season-2/arcane-mage-utility-matrix",
      "coverageLevel": "provenance-only",
      "sourceUrls": [
        "https://www.wowhead.com/guide/classes/mage/arcane/mythic-plus-dungeon-tips"
      ],
      "auditIds": [],
      "claimCount": 0,
      "claimsByType": {
        "mechanic-location": 0,
        "utility-rating": 0,
        "utility-mention": 0,
        "placeholder": 0
      },
      "claimsByDisposition": {
        "accepted": 0,
        "rejected-cross-dungeon": 0,
        "rejected-placeholder": 0,
        "unresolved": 0
      },
      "limitations": [
        "The matrix cites a specialization guide, but WHELP has not created a claim-level audit for it yet."
      ]
    },
    {
      "specId": 71,
      "specSlug": "arms-warrior",
      "matrixId": "midnight-season-2/arms-warrior-utility-matrix",
      "coverageLevel": "provenance-only",
      "sourceUrls": [
        "https://www.wowhead.com/guide/classes/warrior/arms/mythic-plus-dungeon-tips"
      ],
      "auditIds": [],
      "claimCount": 0,
      "claimsByType": {
        "mechanic-location": 0,
        "utility-rating": 0,
        "utility-mention": 0,
        "placeholder": 0
      },
      "claimsByDisposition": {
        "accepted": 0,
        "rejected-cross-dungeon": 0,
        "rejected-placeholder": 0,
        "unresolved": 0
      },
      "limitations": [
        "The matrix cites a specialization guide, but WHELP has not created a claim-level audit for it yet."
      ]
    },
    {
      "specId": 259,
      "specSlug": "assassination-rogue",
      "matrixId": "midnight-season-2/assassination-rogue-utility-matrix",
      "coverageLevel": "provenance-only",
      "sourceUrls": [
        "https://www.wowhead.com/guide/classes/rogue/assassination/mythic-plus-dungeon-tips"
      ],
      "auditIds": [],
      "claimCount": 0,
      "claimsByType": {
        "mechanic-location": 0,
        "utility-rating": 0,
        "utility-mention": 0,
        "placeholder": 0
      },
      "claimsByDisposition": {
        "accepted": 0,
        "rejected-cross-dungeon": 0,
        "rejected-placeholder": 0,
        "unresolved": 0
      },
      "limitations": [
        "The matrix cites a specialization guide, but WHELP has not created a claim-level audit for it yet."
      ]
    },
    {
      "specId": 1473,
      "specSlug": "augmentation-evoker",
      "matrixId": "midnight-season-2/augmentation-evoker-utility-matrix",
      "coverageLevel": "provenance-only",
      "sourceUrls": [
        "https://www.wowhead.com/guide/classes/evoker/augmentation/mythic-plus-dungeon-tips"
      ],
      "auditIds": [],
      "claimCount": 0,
      "claimsByType": {
        "mechanic-location": 0,
        "utility-rating": 0,
        "utility-mention": 0,
        "placeholder": 0
      },
      "claimsByDisposition": {
        "accepted": 0,
        "rejected-cross-dungeon": 0,
        "rejected-placeholder": 0,
        "unresolved": 0
      },
      "limitations": [
        "The matrix cites a specialization guide, but WHELP has not created a claim-level audit for it yet."
      ]
    },
    {
      "specId": 102,
      "specSlug": "balance-druid",
      "matrixId": "midnight-season-2/balance-druid-utility-matrix",
      "coverageLevel": "provenance-only",
      "sourceUrls": [
        "https://www.wowhead.com/guide/classes/druid/balance/mythic-plus-dungeon-tips"
      ],
      "auditIds": [],
      "claimCount": 0,
      "claimsByType": {
        "mechanic-location": 0,
        "utility-rating": 0,
        "utility-mention": 0,
        "placeholder": 0
      },
      "claimsByDisposition": {
        "accepted": 0,
        "rejected-cross-dungeon": 0,
        "rejected-placeholder": 0,
        "unresolved": 0
      },
      "limitations": [
        "The matrix cites a specialization guide, but WHELP has not created a claim-level audit for it yet."
      ]
    },
    {
      "specId": 253,
      "specSlug": "beast-mastery-hunter",
      "matrixId": "midnight-season-2/beast-mastery-hunter-utility-matrix",
      "coverageLevel": "provenance-only",
      "sourceUrls": [
        "https://www.wowhead.com/guide/classes/hunter/beast-mastery/mythic-plus-dungeon-tips"
      ],
      "auditIds": [],
      "claimCount": 0,
      "claimsByType": {
        "mechanic-location": 0,
        "utility-rating": 0,
        "utility-mention": 0,
        "placeholder": 0
      },
      "claimsByDisposition": {
        "accepted": 0,
        "rejected-cross-dungeon": 0,
        "rejected-placeholder": 0,
        "unresolved": 0
      },
      "limitations": [
        "The matrix cites a specialization guide, but WHELP has not created a claim-level audit for it yet."
      ]
    },
    {
      "specId": 250,
      "specSlug": "blood-death-knight",
      "matrixId": "midnight-season-2/blood-death-knight-utility-matrix",
      "coverageLevel": "provenance-only",
      "sourceUrls": [
        "https://www.wowhead.com/guide/classes/death-knight/blood/mythic-plus-dungeon-tips"
      ],
      "auditIds": [],
      "claimCount": 0,
      "claimsByType": {
        "mechanic-location": 0,
        "utility-rating": 0,
        "utility-mention": 0,
        "placeholder": 0
      },
      "claimsByDisposition": {
        "accepted": 0,
        "rejected-cross-dungeon": 0,
        "rejected-placeholder": 0,
        "unresolved": 0
      },
      "limitations": [
        "The matrix cites a specialization guide, but WHELP has not created a claim-level audit for it yet."
      ]
    },
    {
      "specId": 268,
      "specSlug": "brewmaster-monk",
      "matrixId": "midnight-season-2/brewmaster-monk-utility-matrix",
      "coverageLevel": "provenance-only",
      "sourceUrls": [
        "https://www.wowhead.com/guide/classes/monk/brewmaster/mythic-plus-dungeon-tips"
      ],
      "auditIds": [],
      "claimCount": 0,
      "claimsByType": {
        "mechanic-location": 0,
        "utility-rating": 0,
        "utility-mention": 0,
        "placeholder": 0
      },
      "claimsByDisposition": {
        "accepted": 0,
        "rejected-cross-dungeon": 0,
        "rejected-placeholder": 0,
        "unresolved": 0
      },
      "limitations": [
        "The matrix cites a specialization guide, but WHELP has not created a claim-level audit for it yet."
      ]
    },
    {
      "specId": 266,
      "specSlug": "demonology-warlock",
      "matrixId": "midnight-season-2/demonology-warlock-utility-matrix",
      "coverageLevel": "provenance-only",
      "sourceUrls": [
        "https://www.wowhead.com/guide/classes/warlock/demonology/mythic-plus-dungeon-tips"
      ],
      "auditIds": [],
      "claimCount": 0,
      "claimsByType": {
        "mechanic-location": 0,
        "utility-rating": 0,
        "utility-mention": 0,
        "placeholder": 0
      },
      "claimsByDisposition": {
        "accepted": 0,
        "rejected-cross-dungeon": 0,
        "rejected-placeholder": 0,
        "unresolved": 0
      },
      "limitations": [
        "The matrix cites a specialization guide, but WHELP has not created a claim-level audit for it yet."
      ]
    },
    {
      "specId": 267,
      "specSlug": "destruction-warlock",
      "matrixId": "midnight-season-2/destruction-warlock-utility-matrix",
      "coverageLevel": "provenance-only",
      "sourceUrls": [
        "https://www.wowhead.com/guide/classes/warlock/destruction/mythic-plus-dungeon-tips"
      ],
      "auditIds": [],
      "claimCount": 0,
      "claimsByType": {
        "mechanic-location": 0,
        "utility-rating": 0,
        "utility-mention": 0,
        "placeholder": 0
      },
      "claimsByDisposition": {
        "accepted": 0,
        "rejected-cross-dungeon": 0,
        "rejected-placeholder": 0,
        "unresolved": 0
      },
      "limitations": [
        "The matrix cites a specialization guide, but WHELP has not created a claim-level audit for it yet."
      ]
    },
    {
      "specId": 1467,
      "specSlug": "devastation-evoker",
      "matrixId": "midnight-season-2/devastation-evoker-utility-matrix",
      "coverageLevel": "provenance-only",
      "sourceUrls": [
        "https://www.wowhead.com/guide/classes/evoker/devastation/mythic-plus-dungeon-tips"
      ],
      "auditIds": [],
      "claimCount": 0,
      "claimsByType": {
        "mechanic-location": 0,
        "utility-rating": 0,
        "utility-mention": 0,
        "placeholder": 0
      },
      "claimsByDisposition": {
        "accepted": 0,
        "rejected-cross-dungeon": 0,
        "rejected-placeholder": 0,
        "unresolved": 0